contractNo,supplierName,address,phone,email,specialty
ID12,SC AMBRA GRISEA SRL,"Pitesti, str.Nicolae Balcescu, bl.L6, sc.F, ap.2-4",0248-610063,ambramedical@yahoo.com,Ingrijiri medicale la domiciliu
ID15,SC KARMA HELP PROMED SRL,"Pitesti, str.Dacia, nr.3,camera 2",0735-531999,karmapromed@yahoo.com,Ingrijiri medicale la domiciliu
ID16,ASOCIATIA PT. SANATATE DOMNESTI,"Domnesti, str.Tudor Vladimirescu, nr.6",0742-191114,nina.uta02@gmail.com,Ingrijiri medicale la domiciliu
ID19,"ASOCIATIA ""SPRIJIN PENTRU TINE""","Campulung-Muscel, str.I.C.Bratianu, nr.2, bl.B5, SC.a, et.4, ap.19",0741-091919,proca10@yahoo.com,Ingrijiri medicale la domiciliu
ID22,SC ALI GINMED ANDRE SRL,"Curtea-de -Arges, str.Valea Iasului, bl.A7, et.1, ap.5",0752-293789,gina.vasilica@yahoo.com,Ingrijiri medicale la domiciliu
ID25,SC RIANA TRAINING SUPPORT SRL-D,"Stefanesti, sat Valea-Mare-Podgoria, str.Cavalerului, nr.32",0745-170179,rianatraining@yahoo.com,Ingrijiri medicale la domiciliu
